{
  "allowed_differences": [
    "Repository-owned examples, CI, release instructions, and public landing documentation live outside the projected package directory.",
    "Stack-owned systemd, authenticated loopback HTTP, bearer credential, and /srv launch profiles are not projected.",
    "The downstream package manifest is generated by the owner-side exporter."
  ],
  "authority_boundary": {
    "exposure": "stdio-default; optional authenticated loopback streamable-http",
    "mcp_role": "local read-only access plane over .aoa session evidence, search, atlas, and diagnostics",
    "mutation_posture": "no write, no repair, no reindex, no relabel, no distillation, no promotion",
    "schema": "aoa_session_memory_mcp_authority_boundary_v1",
    "service_owner": "abyss-stack owns the runnable MCP package only",
    "source_hierarchy": [
      "raw transcript JSONL and raw source metadata",
      "session manifest and raw block ledger",
      "segment Markdown and segment indexes",
      "session.index.json, registry, atlas maps, search index, diagnostics",
      "MCP compact route/evidence packets"
    ],
    "stop_lines": [
      "Do not replace raw transcript evidence with MCP summaries.",
      "Do not write, repair, reindex, relabel, export, distill, or promote session memory from this MCP.",
      "Do not treat generated atlas/search/readiness output as reviewed truth.",
      "Do not expose bulk raw transcript payloads by default.",
      "Do not bind HTTP beyond loopback or bypass the source-owned MCP lifecycle decision."
    ],
    "stronger_owners": [
      ".aoa raw transcript archive and generated indexes",
      ".aoa route-signal classifier, maps, search provider status, and diagnostics",
      "aoa-memo for durable reviewed memory",
      "owning source repositories for source truth",
      "operator intent and authorization"
    ]
  },
  "compatibility": {
    "mcp_sdk": "mcp>=1.28,<2",
    "python": ">=3.11"
  },
  "entrypoints": {
    "aoa-session-memory-mcp": "aoa_session_memory_mcp.cli:main",
    "aoa-session-memory-mcp-server": "aoa_session_memory_mcp.server:main"
  },
  "files": [
    {
      "mode": "0644",
      "path": "DESIGN.md",
      "sha256": "9311d797bd558f3963ec4f56fd6d9838066b08a25067274b425df4b02688de46",
      "size": 12262,
      "source": "owner:DESIGN.md"
    },
    {
      "mode": "0644",
      "path": "LICENSE",
      "sha256": "0b81e2ea9cf9c447b3317b84e5bbaca9f3cf98a5d08ef8d754a3286f21c3392a",
      "size": 10775,
      "source": "repository:LICENSE"
    },
    {
      "mode": "0644",
      "path": "MANIFEST.in",
      "sha256": "eead0cde8223d86119f504653be0971b8720a0b73fe3fffd83c807d6a098b647",
      "size": 334,
      "source": "owner:projection/MANIFEST.in"
    },
    {
      "mode": "0644",
      "path": "PROJECTION.md",
      "sha256": "a35b50fb37f122ce50794eb59df0036b8ff903ac20d38a2170088d04e7f8b8bc",
      "size": 1914,
      "source": "owner:projection/README.md"
    },
    {
      "mode": "0644",
      "path": "README.md",
      "sha256": "be5ec4b49d54f03a1ab05d01d6a5cd63f81f52501a79554f4e380fe0dc01550d",
      "size": 29548,
      "source": "owner:README.md"
    },
    {
      "mode": "0644",
      "path": "docs/BOUNDARIES.md",
      "sha256": "51314c97094f5f070ac27c55cd76322a38baeb488f98c39e84b6ebae82cfdce6",
      "size": 3437,
      "source": "owner:docs/BOUNDARIES.md"
    },
    {
      "mode": "0644",
      "path": "docs/THREAT_MODEL.md",
      "sha256": "17e02837de37a07cc9db3588b4f2e5f8ec20ba551ad21e8197061d823db7bbe3",
      "size": 4912,
      "source": "owner:docs/THREAT_MODEL.md"
    },
    {
      "mode": "0644",
      "path": "package.export.policy.json",
      "sha256": "fed3864265ed2e4ccb29e72fe0fa8c1b7a942ab556cfea63f32515e7c90b08b1",
      "size": 2280,
      "source": "owner:projection/package-export.policy.json"
    },
    {
      "mode": "0644",
      "path": "package.manifest.schema.json",
      "sha256": "eaf5ac375d752a150cefbd9925ebfe44889e60416f694fa0333799f9e8da220c",
      "size": 4418,
      "source": "owner:projection/package.manifest.schema.json"
    },
    {
      "mode": "0644",
      "path": "pyproject.toml",
      "sha256": "4f9b78eb923a1111150fa1c4b6cdbb82d1196ab80decca3d5b175df0bb5cf673",
      "size": 845,
      "source": "owner:pyproject.toml"
    },
    {
      "mode": "0644",
      "path": "scripts/aoa_session_memory_mcp_server.py",
      "sha256": "b42fcd0528e0d780aae3ea9df11ec1f4d94146303ac92fd501fdec5dd114a1ce",
      "size": 323,
      "source": "owner:scripts/aoa_session_memory_mcp_server.py"
    },
    {
      "mode": "0755",
      "path": "scripts/release_check.py",
      "sha256": "c122c6e0044f2803e1693e01f30e5c71003a10a4c765a323f18a5a3164fcf6e3",
      "size": 708,
      "source": "owner:projection/release_check.py"
    },
    {
      "mode": "0755",
      "path": "scripts/validate_package_projection.py",
      "sha256": "ad369d5dfe2899d7cf5a6eb1c96ee4a628ad56969790608c4433c3987f9dbb83",
      "size": 6493,
      "source": "owner:projection/validate_package_projection.py"
    },
    {
      "mode": "0644",
      "path": "scripts/validate_session_memory_mcp.py",
      "sha256": "a1baf144d68d04ba497abbebdfe85f64cf0d3647d715bb889d1440077cedd978",
      "size": 94835,
      "source": "owner:scripts/validate_session_memory_mcp.py"
    },
    {
      "mode": "0644",
      "path": "src/aoa_session_memory_mcp/__init__.py",
      "sha256": "079ba77064cac34262276e52839f3019cc78b2da1182cca123fed450ac4c3476",
      "size": 135,
      "source": "owner:src/aoa_session_memory_mcp/__init__.py"
    },
    {
      "mode": "0644",
      "path": "src/aoa_session_memory_mcp/_http_auth.py",
      "sha256": "9fd4fec732e5c1e3bca3ef315710ef98963b0d10f6c9ee3011739a9f06f36746",
      "size": 5581,
      "source": "owner:src/aoa_session_memory_mcp/_http_auth.py"
    },
    {
      "mode": "0644",
      "path": "src/aoa_session_memory_mcp/cli.py",
      "sha256": "9bdc5b36caa1b565bfd87c8c3ca21f34e1227ce74077bd4980e416b2db84e66c",
      "size": 31879,
      "source": "owner:src/aoa_session_memory_mcp/cli.py"
    },
    {
      "mode": "0644",
      "path": "src/aoa_session_memory_mcp/contract.py",
      "sha256": "5c9cb6ddf83d7423e05555f9548de911ea7b7900da33d5a70283d73bdbf668fa",
      "size": 3862,
      "source": "owner:src/aoa_session_memory_mcp/contract.py"
    },
    {
      "mode": "0644",
      "path": "src/aoa_session_memory_mcp/core.py",
      "sha256": "0e2e463cf2763e4226eab5b18d1ce88c24285778f7293106426d94092b562720",
      "size": 476529,
      "source": "owner:src/aoa_session_memory_mcp/core.py"
    },
    {
      "mode": "0644",
      "path": "src/aoa_session_memory_mcp/server.py",
      "sha256": "67bd895d5f5490dd537b8f341f479bfd859372c563e107ffef44800f5da5b745",
      "size": 34101,
      "source": "owner:src/aoa_session_memory_mcp/server.py"
    },
    {
      "mode": "0644",
      "path": "tests/conftest.py",
      "sha256": "24b0de9831e418e324bf6c5151b4f41748d7a4c76d82652ea3ef0d38cae46023",
      "size": 186,
      "source": "owner:tests/conftest.py"
    },
    {
      "mode": "0644",
      "path": "tests/test_package_projection.py",
      "sha256": "360bf714417a5d947bffa187164fd4a713e21cf3a7fd3107ce14bf54bf1b5bd3",
      "size": 816,
      "source": "owner:projection/test_package_projection.py"
    },
    {
      "mode": "0644",
      "path": "tests/test_session_memory_mcp.py",
      "sha256": "4d0d098cce64132ae17d793b2f7c0b5d70339f8f06d0b9fc0c95bf80657418b7",
      "size": 374739,
      "source": "owner:tests/test_session_memory_mcp.py"
    }
  ],
  "mcp_surface": {
    "prompts": [
      {
        "arguments": [
          {
            "description": null,
            "name": "anchor",
            "required": true
          }
        ],
        "description": "Prompt route for debugging a skill, MCP, hook, tool, path, or similar anchor.",
        "name": "debug-operational-anchor"
      },
      {
        "arguments": [
          {
            "description": null,
            "name": "anchor",
            "required": true
          }
        ],
        "description": "Prompt route for reviewing whether a recurring pattern deserves promotion.",
        "name": "promotion-candidate-review"
      },
      {
        "arguments": [
          {
            "description": null,
            "name": "session",
            "required": false
          }
        ],
        "description": "Prompt route for rehydrating a session without flattening raw evidence.",
        "name": "session-rehydrate"
      },
      {
        "arguments": [
          {
            "description": null,
            "name": "ref",
            "required": true
          }
        ],
        "description": "Prompt route for handling stale evidence refs.",
        "name": "stale-ref-repair-plan"
      },
      {
        "arguments": [
          {
            "description": null,
            "name": "anchor",
            "required": true
          }
        ],
        "description": "Prompt route for tracing a stable agent-process anchor.",
        "name": "trace-agent-process"
      },
      {
        "arguments": [
          {
            "description": null,
            "name": "intent",
            "required": true
          }
        ],
        "description": "Prompt route for checking evidence before memory writeback.",
        "name": "writeback-evidence-check"
      }
    ],
    "resource_templates": [
      {
        "description": "",
        "input_schema": {
          "properties": {
            "kind": {
              "title": "Kind",
              "type": "string"
            }
          },
          "required": [
            "kind"
          ],
          "title": "diagnostics_resourceArguments",
          "type": "object"
        },
        "mime_type": "text/plain",
        "name": "diagnostics_resource",
        "uri_template": "aoa-session-memory://diagnostics/latest/{kind}"
      },
      {
        "description": "",
        "input_schema": {